name,id,minutes,contributor_id,submitted,tags,nutrition,n_steps,steps,description,ingredients,n_ingredients
classic lemonade ice pops,514243,33,37779,2014-03-13,"['60-minutes-or-less', 'time-to-make', 'course', 'main-ingredient', 'preparation', 'low-protein', 'healthy', '5-ingredients-or-less', 'desserts', 'fruit', 'easy', 'low-fat', 'frozen-desserts', 'dietary', 'low-sodium', 'low-cholesterol', 'low-saturated-fat', 'low-calorie', 'healthy-2', 'low-in-something', 'citrus', 'lemon']","[61.9, 0.0, 61.0, 0.0, 0.0, 0.0, 5.0]",7,"['in a small saucepan over medium heat , combine cup water , sugar and lemon zest', 'bring to a boil , then decrease heat and simmer for 3 minutes', 'set aside to cool', 'strain syrup through sieve placed over large measuring cup , discarding solids', 'whisk in lemon juice and remaining 2 cups water', 'pour into molds and freeze until slushy , then insert sticks and freeze until solid , for at least 4 hours', 'if you are using an ice pop kit , follow the manufacturers instructions']",in ‘200 best ice pop recipes’,"['water', 'sugar', 'lemon zest', 'fresh lemon juice']",4
frozen lemonade cooler,62434,10,37779,2003-05-17,"['15-minutes-or-less', 'time-to-make', 'course', 'main-ingredient', 'preparation', 'occasion', 'low-protein', 'healthy', '5-ingredients-or-less', 'beverages', 'fruit', 'easy', 'kid-friendly', 'low-fat', 'spring', 'summer', 'food-processor-blender', 'dietary', 'low-sodium', 'low-cholesterol', 'seasonal', 'low-saturated-fat', 'low-calorie', 'low-in-something', 'citrus', 'lemon', 'brunch', 'equipment', 'small-appliance', 'presentation', 'served-cold', '3-steps-or-less']","[137.3, 1.0, 113.0, 1.0, 1.0, 2.0, 10.0]",3,"['add all ingredients to the container of an electric blender', 'blend on high speed for 20-30 seconds or until smooth', 'serve immediately in chilled glasses']",kickin' flavor for all the lemon lovers. from mr. food.,"['lemon sherbet', 'frozen lemonade concentrate', 'water', 'lemon zest']",4
apple puree applesauce   real apple juice  no added sugar,180136,5,322326,2006-08-01,"['15-minutes-or-less', 'time-to-make', 'course', 'main-ingredient', 'cuisine', 'preparation', 'occasion', 'south-west-pacific', 'for-1-or-2', 'low-protein', 'healthy', '5-ingredients-or-less', 'breakfast', 'desserts', 'fruit', 'easy', 'steam', 'beginner-cook', 'kid-friendly', 'low-fat', 'picnic', 'dietary', 'low-sodium', 'low-cholesterol', 'infant-baby-friendly', 'low-saturated-fat', 'low-calorie', 'brown-bag', 'inexpensive', 'new-zealand', 'toddler-friendly', 'low-in-something', 'apples', 'brunch', 'to-go', 'camping', 'number-of-servings', 'technique']","[71.8, 0.0, 57.0, 0.0, 0.0, 0.0, 6.0]",10,"['peel , core and cut apple into slices / chunks', 'place slices or chunks into a pan with just enough water to slightly cover apples', 'boil / steam until tender', 'be sure to check on the water level and stir', 'drain juice', 'mash apples with a potato masher to achieve a smooth applesauce consistency', 'place into your choice of appliance for pureeing and begin pureeing', 'add the reserved water as necessary to achieve a smooth , thin puree', 'add cereal to thicken the applesauce', 'the remaining juice is your pure apple juice']","this may sound weird, but i love baby food, only certain types though, the
yoghurts and fruit purees, and you know they have no rubbish so can eat them
without the guilt, this is my favourite baby food. if you want to make more for storage, just add more apples and use required water. it also works great as an applesauce for pork if you don't puree it","['apple', 'water']",2
morning sunshine   hot lemon drink,59070,4,58104,2003-04-09,"['15-minutes-or-less', 'time-to-make', 'course', 'main-ingredient', 'preparation', 'for-1-or-2', 'low-protein', 'healthy', '5-ingredients-or-less', 'very-low-carbs', 'beverages', 'fruit', 'easy', 'low-fat', 'vegan', 'vegetarian', 'dietary', 'low-sodium', 'low-cholesterol', 'low-saturated-fat', 'low-calorie', 'low-carb', 'low-in-something', 'citrus', 'lemon', 'number-of-servings', 'presentation', 'served-hot', '3-steps-or-less']","[5.3, 0.0, 2.0, 0.0, 0.0, 0.0, 0.0]",1,['add juice from lemon to hot water& drink'],"forget the coffee. this is a great way to start the day! cleanse from the inside out. cleanse the body of impurity by rinsing the system and stimulating digestion. drinking this  first thing in the morning will also help to ""tone"" your body because lemon stimulates cleansing of both the gallbladder and liver. relieves symptoms of indigestion such as heartburn, bloating and belching. controls constipation and diarrhea by eliminating waste efficiently. cleanses the liver.","['lemon, juice of', 'hot water']",2
